{
  "cluster_label": "head_transmedullary Y neuron TmY14",
  "working_definition": "Author cell type 'transmedullary Y neuron TmY14' of the Fly Cell Atlas (Li et al. 2022; adult flies), annotated by the authors with FBbt:00111286 'transmedullary Y neuron TmY14'. Found in: 10x:head (153 cells).",
  "searches_performed": [
    "authors' ontology id FBbt:00111286 (FBbt fbbt/releases/2026-10-01)",
    "'adult transmedullary Y neuron TmY14' (exact label / exact synonym, FBbt fbbt/releases/2026-10-01)",
    "'transmedullary Y neuron TmY14' (exact label / exact synonym, FBbt fbbt/releases/2026-10-01)"
  ],
  "best_match": {
    "fbbt_term": "transmedullary Y neuron TmY14",
    "fbbt_id": "FBbt:00111286",
    "fbbt_definition": "Transmedullary Y wide-field neuron that terminates in the lobula and lobula plate (Takemura et al., 2013). It displays fine arborizations in medulla layers M3-M5 and M8-M10 (Takemura et al., 2013). Some of these cells have an axon that projects to the central brain, an unusual feature in TmY neurons (Takemura et al., 2013; Shinomiya et al., 2019; Matsliah et al., 2024), but this axon has very few synapses (Matsliah et al., 2024). It is glutamatergic (Konstantinides et al., 2022).",
    "match_type": "exact match",
    "skos_mapping": "skos:exactMatch",
    "confidence": "high"
  },
  "justification": "The authors annotated this type with FBbt:00111286 'transmedullary Y neuron TmY14', a current (non-obsolete) FBbt cell term; FBbt has no adult-specific variant of it. The authors' typing is taken at face value.",
  "other_candidates": [],
  "recommendation": "Map to the authors' term FBbt:00111286 'transmedullary Y neuron TmY14', exact match.",
  "new_term_needed": false,
  "verification_needed": false
}
