{
  "cluster_label": "16_18h_6",
  "working_definition": "Nuclei of the authors' 'brain' cluster(s) (Calderon et al. 2022), embryos 0-18 h.",
  "searches_performed": [
    "brain"
  ],
  "other_candidates": [],
  "new_term_needed": false,
  "verification_needed": false,
  "best_match": {
    "fbbt_term": "larval CNS neuron",
    "fbbt_id": "FBbt:00059273",
    "fbbt_definition": "Any neuron that has its soma in the late embryonic or larval central nervous system.",
    "match_type": "broad match",
    "skos_mapping": "skos:broadMatch",
    "confidence": "high"
  },
  "justification": "The authors' annotation 'brain'. Brain clusters at 10-18 h, mostly neurons: larval CNS neuron, which covers the late embryo (curator: a tissue type to its main cell type).",
  "recommendation": "Map to FBbt:00059273 larval CNS neuron (broad match)."
}
