{
  "cluster_label": "main_N61",
  "working_definition": "Unidentified numbered cluster (class N = neuron) from the Kurmangaliyev 2020 optic lobe atlas. The authors assigned it a cell class but no named cell-type identity.",
  "searches_performed": [
    "(placeholder: class-based broad assignment; no literature search performed)"
  ],
  "best_match": {
    "fbbt_term": "adult optic lobe neuron",
    "fbbt_id": "FBbt:00003702",
    "fbbt_definition": "Neuron of the adult optic lobe.",
    "match_type": "broad match",
    "skos_mapping": "skos:broadMatch",
    "confidence": "low"
  },
  "justification": "No named identity was assigned to cluster N61 by the atlas authors; only its cell class (N) is known. The honest mapping is a broad match to the class-level FBbt term FBbt:00003702 (adult optic lobe neuron). Not a specific cell-type assignment.",
  "other_candidates": [],
  "recommendation": "Class-based broad placeholder (adult optic lobe neuron). Revisit if the cluster's identity is resolved in future work.",
  "new_term_needed": false,
  "verification_needed": false
}
