{
  "cluster_label": "knot_48h_vPN_DA1",
  "working_definition": "Olfactory projection neuron type vPN_DA1 of Xie et al. 2021 at 48 h APF or adult (pharate adult / adult).",
  "searches_performed": [
    "adult antennal lobe projection neuron vPN_DA1"
  ],
  "best_match": {
    "fbbt_term": "adult antennal lobe projection neuron DA1 vPN",
    "fbbt_id": "FBbt:00067372",
    "fbbt_definition": "Adult uniglomerular antennal lobe projection neuron from the ventral neuroblast (ALv1) lineage whose dendrites mainly innervate antennal lobe glomerulus DA1 (Jefferis et al., 2007; Bates et al., 2020). It projects via the mediolateral antennal lobe tract to reach the lateral horn directly (Jefferis et al., 2007). This neuron is GABAergic and there is around one per hemisphere ((Jefferis et al., 2007; Bates et al., 2020).",
    "match_type": "exact match",
    "skos_mapping": "skos:exactMatch",
    "confidence": "high"
  },
  "justification": "DA1 vPNs (knot analysis). Mature term from the pharate adult stage (curator). kn+ PNs (knot analysis, no lineage column): the paper states they \"include six types of adPNs and two vPNs\" (Figure 2), i.e. D, DM6, VA1v, VM2, VM7, VM5v (adPN) and the two vPNs.",
  "other_candidates": [],
  "recommendation": "Map to FBbt:00067372 adult antennal lobe projection neuron DA1 vPN (exact match).",
  "new_term_needed": false,
  "verification_needed": false
}
