{
  "cluster_label": "TmY5a",
  "working_definition": "Author type 'TmY5a' of the Özel et al. 2021 optic lobe atlas (Supplementary Table 1).",
  "searches_performed": [
    "'TmY5a' (exact label / exact synonym, FBbt fbbt/releases/2026-10-01)"
  ],
  "best_match": {
    "fbbt_term": "immature transmedullary Y neuron TmY5a",
    "fbbt_id": "FBbt:00052339",
    "fbbt_definition": "Immature form of the transmedullary Y neuron TmY5a (Konstantinides et al., 2022). It is a Notch OFF hemilineage secondary neuron, born from a medulla forming neuroblast during the Erm/Ey temporal window (Konstantinides et al., 2022).",
    "match_type": "exact match",
    "skos_mapping": "skos:exactMatch",
    "confidence": "high"
  },
  "justification": "'TmY5a' is FBbt:00003823 'transmedullary Y neuron TmY5a'; at P15-P40 the cells are developing, so its immature form FBbt:00052339 (curator: immature terms up to the pupal stage).",
  "other_candidates": [
    {
      "fbbt_term": "transmedullary Y neuron TmY5a",
      "fbbt_id": "FBbt:00003823",
      "fbbt_definition": "Transmedullary Y narrow field neuron that terminates with both fine and bleb-type arborizations in lobula layers 4, 5 and 6, and in lobula plate layer 3, but only has fine arborizations in lobula plate layer 1. It displays both fine and bleb-type arborizations in medulla layers M6 and M8, and has fine arborizations in medulla layers M2, M3, M4, M5 and M9 (Morante and Desplan, 2008; Fischbach and Dittrich (1989). It is glutamatergic (Davis et al., 2020).",
      "reason_rejected": "Mature form; used from the pharate adult stage."
    }
  ],
  "recommendation": "Map to FBbt:00052339 'immature transmedullary Y neuron TmY5a' (exact match).",
  "new_term_needed": false,
  "verification_needed": false
}
