{
  "cluster_label": "6_8h_8",
  "working_definition": "Nuclei of the authors' 'brain primordium' cluster(s) (Calderon et al. 2022), embryos 0-18 h.",
  "searches_performed": [
    "brain primordium"
  ],
  "other_candidates": [],
  "new_term_needed": false,
  "verification_needed": false,
  "best_match": {
    "fbbt_term": "embryonic neuroblast",
    "fbbt_id": "FBbt:00001332",
    "fbbt_definition": "Any neuroblast of the embryo.",
    "match_type": "broad match",
    "skos_mapping": "skos:broadMatch",
    "confidence": "high"
  },
  "justification": "The authors' annotation 'brain primordium'. The brain primordium at 6-10 h: its neuroblasts (curator).",
  "recommendation": "Map to FBbt:00001332 embryonic neuroblast (broad match)."
}
