{
  "cluster_label": "main_adult_VC2",
  "working_definition": "Olfactory projection neuron type VC2 of Xie et al. 2021 at 48 h APF or adult (pharate adult / adult).",
  "searches_performed": [
    "adult antennal lobe projection neuron VC2"
  ],
  "best_match": {
    "fbbt_term": "adult antennal lobe projection neuron VC2 lPN",
    "fbbt_id": "FBbt:00007449",
    "fbbt_definition": "Existence confirmed by Greg Jefferis (personal communication). Adult uniglomerular antennal lobe projection neuron from the ALl1 dorsal hemilineage with dendrites that mainly innervate antennal lobe glomerulus VC2 (Bates et al., 2020). The axons of these neurons innervate the lateral horn. There is around one of these per hemisphere, it fasciculates with the medial antennal lobe tract and it is cholinergic (Bates et al., 2020).",
    "match_type": "exact match",
    "skos_mapping": "skos:exactMatch",
    "confidence": "high"
  },
  "justification": "VC2 PNs; lineage lPN. Mature term from the pharate adult stage (curator). Lineage: the authors' per-cell `lineage` for this type in the main analysis: lPN 97, unlabelled 3, adPN 1.",
  "other_candidates": [],
  "recommendation": "Map to FBbt:00007449 adult antennal lobe projection neuron VC2 lPN (exact match).",
  "new_term_needed": false,
  "verification_needed": false
}
