{
  "cluster_label": "main_G173",
  "working_definition": "Unidentified numbered cluster (class G = glial cell) from the Kurmangaliyev 2020 optic lobe atlas. The authors assigned it a cell class but no named cell-type identity.",
  "searches_performed": [
    "(placeholder: class-based broad assignment; no literature search performed)"
  ],
  "best_match": {
    "fbbt_term": "adult optic lobe glial cell",
    "fbbt_id": "FBbt:00100517",
    "fbbt_definition": "Glial cell of the adult that is associated with the optic lobe.",
    "match_type": "broad match",
    "skos_mapping": "skos:broadMatch",
    "confidence": "low"
  },
  "justification": "No named identity was assigned to cluster G173 by the atlas authors; only its cell class (G) is known. The honest mapping is a broad match to the class-level FBbt term FBbt:00100517 (adult optic lobe glial cell). Not a specific cell-type assignment.",
  "other_candidates": [],
  "recommendation": "Class-based broad placeholder (adult optic lobe glial cell). Revisit if the cluster's identity is resolved in future work.",
  "new_term_needed": false,
  "verification_needed": false
}
