{
  "cluster_label": "Cells of ellipsoid body and fan shaped body",
  "working_definition": "Cells of the authors' 'Cells of ellipsoid body and fan shaped body' cluster(s), adult brains (reference medium).",
  "searches_performed": [
    "Cells of ellipsoid body and fan shaped body"
  ],
  "other_candidates": [],
  "new_term_needed": false,
  "verification_needed": false,
  "best_match": {
    "fbbt_term": "adult central complex neuron",
    "fbbt_id": "FBbt:00049819",
    "fbbt_definition": "Any neuron (FBbt:00005106) that has synaptic IO in region some adult central complex (FBbt:00003632).",
    "match_type": "broad match",
    "skos_mapping": "skos:broadMatch",
    "confidence": "high"
  },
  "justification": "The authors' annotation 'Cells of ellipsoid body and fan shaped body'. Ellipsoid body and fan-shaped body cells: the central complex neuron (the fan-shaped body-ellipsoid body neuron is one specific class the name does not imply).",
  "recommendation": "Map to FBbt:00049819 adult central complex neuron (broad match)."
}
